{
  "$schema": "./options.schema.json",
  "version": "oct22_01",
  "files": {
    "template": "LucianBlagaHS-A4TicketSheet.png",
    "output": {
      "filename": "LucianBlagaHS-TICKET_SHEET",
      "extension": "png"
    }
  },
  "ticketsToGenerate": 245,
  "ticketsPerPage": 7,
  "ticketPostitions": [
    { "x": 90, "y": 165, "rotation": "R" },
    { "x": 90, "y": 845, "rotation": "R" },
    { "x": 90, "y": 1528, "rotation": "R" },
    { "x": 90, "y": 2203, "rotation": "R" },
    { "x": 90, "y": 2885, "rotation": "R" },
    { "x": 1850, "y": 1515 },
    { "x": 1850, "y": 3200 }
  ]
}
